{
  "action_counts": {
    "archive_public": 7,
    "generated_reference": 4,
    "keep_in_repo": 57,
    "merge_into": 15,
    "migrate_preserve": 35,
    "migrate_rewrite": 50,
    "retain_third_party": 7
  },
  "classified_count": 0,
  "document_count": 175,
  "generated_by": "scripts/generate_legacy_migration.py",
  "generated_record_count": 104,
  "generated_reference_coverage": {
    "json.flags": {
      "json_flags": 648,
      "scope": "partial-direct-definitions"
    },
    "json.proficiencies-index": {
      "proficiencies": 50,
      "proficiency_categories": 21,
      "scope": "partial-declared-inputs",
      "summary": "50 proficiencies and 21 categories from `data/json/proficiencies/misc.json`, `data/json/proficiencies/proficiency_categories.json`, `data/mods/Magiclysm/proficiencies.json`"
    },
    "mods.aftershock-exoplanet.balance.ranged-weapons": {
      "aftershock_item_definitions": 18,
      "aftershock_item_groups": 37,
      "scope": "partial-balance-inputs"
    },
    "mods.mind-over-matter.power-reference": {
      "mind_over_matter_spells": 226,
      "scope": "partial-direct-fields"
    }
  },
  "generated_unique_target_count": 99,
  "history_experiment": {
    "author_identities": 226,
    "commits": 1351,
    "decision": "retain-source-history-links",
    "final_paths": 111,
    "fsck": "passed",
    "rename_records": 0,
    "selected_final_paths": 111,
    "self_contained_size_mib": 14
  },
  "in_progress_count": 0,
  "inventory_source_commit": "0378ca2b84303cf614c617c9d9eaa50138cd21ff",
  "migration_status_counts": {
    "archived": 7,
    "stubbed": 104,
    "verified": 64
  },
  "missing_target_count": 0,
  "pending_source_pr": "https://github.com/CrimsonCrossBunker/Cataclysm-Cleanwater-Bomb/pull/568",
  "preexisting_covered_record_count": 7,
  "preexisting_unique_target_count": 6,
  "records": [
    {
      "action": "keep_in_repo",
      "catalog_id": null,
      "contributors": [
        "LunaGlaze",
        "thaelina"
      ],
      "history_url": "https://github.com/CrimsonCrossBunker/Cataclysm-Cleanwater-Bomb/commits/c1b0f95c6d1b074fc49ee2a7976819c124b69047/CODE_OF_CONDUCT.md",
      "last_applicable_commit": "0378ca2b84303cf614c617c9d9eaa50138cd21ff",
      "license": "CC-BY-SA-3.0",
      "migration_status": "verified",
      "original_path": "CODE_OF_CONDUCT.md",
      "replacement": null,
      "source_commit": "0378ca2b84303cf614c617c9d9eaa50138cd21ff",
      "stable_document_id": "governance.code-of-conduct",
      "target_path": "CODE_OF_CONDUCT.md"
    },
    {
      "action": "keep_in_repo",
      "catalog_id": null,
      "contributors": [
        "David Seguin",
        "thaelina"
      ],
      "history_url": "https://github.com/CrimsonCrossBunker/Cataclysm-Cleanwater-Bomb/commits/c1b0f95c6d1b074fc49ee2a7976819c124b69047/CONTRIBUTING.md",
      "last_applicable_commit": "0378ca2b84303cf614c617c9d9eaa50138cd21ff",
      "license": "CC-BY-SA-3.0",
      "migration_status": "verified",
      "original_path": "CONTRIBUTING.md",
      "replacement": null,
      "source_commit": "0378ca2b84303cf614c617c9d9eaa50138cd21ff",
      "stable_document_id": "governance.contributing",
      "target_path": "CONTRIBUTING.md"
    },
    {
      "action": "keep_in_repo",
      "catalog_id": null,
      "contributors": [
        "thaelina"
      ],
      "history_url": "https://github.com/CrimsonCrossBunker/Cataclysm-Cleanwater-Bomb/commits/c1b0f95c6d1b074fc49ee2a7976819c124b69047/ISSUES.md",
      "last_applicable_commit": "0378ca2b84303cf614c617c9d9eaa50138cd21ff",
      "license": "CC-BY-SA-3.0",
      "migration_status": "verified",
      "original_path": "ISSUES.md",
      "replacement": null,
      "source_commit": "0378ca2b84303cf614c617c9d9eaa50138cd21ff",
      "stable_document_id": "governance.issue-workflow",
      "target_path": "ISSUES.md"
    },
    {
      "action": "keep_in_repo",
      "catalog_id": null,
      "contributors": [
        "LYHGLYTX",
        "LunaGlaze",
        "Asthmatic123",
        "EArias",
        "lapp2333xhj",
        "thaelina"
      ],
      "history_url": "https://github.com/CrimsonCrossBunker/Cataclysm-Cleanwater-Bomb/commits/c1b0f95c6d1b074fc49ee2a7976819c124b69047/README.md",
      "last_applicable_commit": "0378ca2b84303cf614c617c9d9eaa50138cd21ff",
      "license": "CC-BY-SA-3.0",
      "migration_status": "verified",
      "original_path": "README.md",
      "replacement": null,
      "source_commit": "0378ca2b84303cf614c617c9d9eaa50138cd21ff",
      "stable_document_id": "project.readme",
      "target_path": "README.md"
    },
    {
      "action": "keep_in_repo",
      "catalog_id": null,
      "contributors": [
        "LYHGLYTX",
        "EliadOArias"
      ],
      "history_url": "https://github.com/CrimsonCrossBunker/Cataclysm-Cleanwater-Bomb/commits/c1b0f95c6d1b074fc49ee2a7976819c124b69047/SYNC_EXCLUDED_PRS.md",
      "last_applicable_commit": "0378ca2b84303cf614c617c9d9eaa50138cd21ff",
      "license": "CC-BY-SA-3.0",
      "migration_status": "verified",
      "original_path": "SYNC_EXCLUDED_PRS.md",
      "replacement": null,
      "source_commit": "0378ca2b84303cf614c617c9d9eaa50138cd21ff",
      "stable_document_id": "upstream.excluded-prs",
      "target_path": "SYNC_EXCLUDED_PRS.md"
    },
    {
      "action": "keep_in_repo",
      "catalog_id": null,
      "contributors": [
        "LYHGLYTX"
      ],
      "history_url": "https://github.com/CrimsonCrossBunker/Cataclysm-Cleanwater-Bomb/commits/c1b0f95c6d1b074fc49ee2a7976819c124b69047/TRANSLATION_CREDITS.md",
      "last_applicable_commit": "0378ca2b84303cf614c617c9d9eaa50138cd21ff",
      "license": "CC-BY-SA-3.0",
      "migration_status": "verified",
      "original_path": "TRANSLATION_CREDITS.md",
      "replacement": null,
      "source_commit": "0378ca2b84303cf614c617c9d9eaa50138cd21ff",
      "stable_document_id": "translation.credits",
      "target_path": "TRANSLATION_CREDITS.md"
    },
    {
      "action": "merge_into",
      "catalog_id": "json.loading-order",
      "catalog_status": "draft",
      "contributors": [
        "thaelina"
      ],
      "en_path": "reference/json/loading-order.md",
      "history_url": "https://github.com/CrimsonCrossBunker/Cataclysm-Cleanwater-Bomb/commits/c1b0f95c6d1b074fc49ee2a7976819c124b69047/data/json/LOADING_ORDER.md",
      "last_applicable_commit": "5f23722ff28c5cc552baa0422b32b1f10fd890fa",
      "license": "CC-BY-SA-3.0",
      "migration_status": "stubbed",
      "original_path": "data/json/LOADING_ORDER.md",
      "replacement": "https://crimsoncrossbunker.github.io/CCB-Docs/reference/json/loading-order/",
      "source_commit": "0378ca2b84303cf614c617c9d9eaa50138cd21ff",
      "stable_document_id": "legacy.data-json-loading-order",
      "target_path": "docs/zh_CN/reference/json/loading-order.md",
      "zh_path": "reference/json/loading-order.md"
    },
    {
      "action": "keep_in_repo",
      "catalog_id": null,
      "contributors": [
        "thaelina"
      ],
      "history_url": "https://github.com/CrimsonCrossBunker/Cataclysm-Cleanwater-Bomb/commits/c1b0f95c6d1b074fc49ee2a7976819c124b69047/data/json/npcs/godco/NECC_INFO.md",
      "last_applicable_commit": "5f23722ff28c5cc552baa0422b32b1f10fd890fa",
      "license": "CC-BY-SA-3.0",
      "migration_status": "verified",
      "original_path": "data/json/npcs/godco/NECC_INFO.md",
      "replacement": null,
      "source_commit": "0378ca2b84303cf614c617c9d9eaa50138cd21ff",
      "stable_document_id": "content.npc.godco-roster",
      "target_path": "data/json/npcs/godco/NECC_INFO.md"
    },
    {
      "action": "keep_in_repo",
      "catalog_id": null,
      "contributors": [
        "thaelina"
      ],
      "history_url": "https://github.com/CrimsonCrossBunker/Cataclysm-Cleanwater-Bomb/commits/c1b0f95c6d1b074fc49ee2a7976819c124b69047/data/json/npcs/refugee_center/FREE_MERCHANTS_INFO.md",
      "last_applicable_commit": "5f23722ff28c5cc552baa0422b32b1f10fd890fa",
      "license": "CC-BY-SA-3.0",
      "migration_status": "verified",
      "original_path": "data/json/npcs/refugee_center/FREE_MERCHANTS_INFO.md",
      "replacement": null,
      "source_commit": "0378ca2b84303cf614c617c9d9eaa50138cd21ff",
      "stable_document_id": "content.npc.free-merchants-economy",
      "target_path": "data/json/npcs/refugee_center/FREE_MERCHANTS_INFO.md"
    },
    {
      "action": "migrate_rewrite",
      "catalog_id": "api.lua.v5.overview",
      "catalog_status": "draft",
      "contributors": [
        "LYHGLYTX"
      ],
      "en_path": "api/lua/v5/overview.md",
      "history_url": "https://github.com/CrimsonCrossBunker/Cataclysm-Cleanwater-Bomb/commits/c1b0f95c6d1b074fc49ee2a7976819c124b69047/data/lua/README.md",
      "last_applicable_commit": "5f23722ff28c5cc552baa0422b32b1f10fd890fa",
      "license": "CC-BY-SA-3.0",
      "migration_status": "stubbed",
      "original_path": "data/lua/README.md",
      "replacement": "https://crimsoncrossbunker.github.io/CCB-Docs/api/lua/v5/overview/",
      "source_commit": "0378ca2b84303cf614c617c9d9eaa50138cd21ff",
      "stable_document_id": "lua.v5.overview",
      "target_path": "docs/zh_CN/api/lua/v5/overview.md",
      "zh_path": "api/lua/v5/overview.md"
    },
    {
      "action": "migrate_rewrite",
      "catalog_id": "api.lua.v5.example-mod",
      "catalog_status": "draft",
      "contributors": [
        "LYHGLYTX"
      ],
      "en_path": "api/lua/v5/example-mod.md",
      "history_url": "https://github.com/CrimsonCrossBunker/Cataclysm-Cleanwater-Bomb/commits/c1b0f95c6d1b074fc49ee2a7976819c124b69047/data/lua/examples/api_v5_mod/README.md",
      "last_applicable_commit": "5f23722ff28c5cc552baa0422b32b1f10fd890fa",
      "license": "CC-BY-SA-3.0",
      "migration_status": "stubbed",
      "original_path": "data/lua/examples/api_v5_mod/README.md",
      "replacement": "https://crimsoncrossbunker.github.io/CCB-Docs/api/lua/v5/example-mod/",